{
    "$schema": "../../schemas/player.schema.json",

    "slug": "missy",
    "nickname": "Missy",
    "name": "Halat Naby",
    "birthday": "1992-11-08",
    "nationality": "nl",
    "links": [
        { "name": "FACEIT", "url": "https://www.faceit.com/en/players/FreeNN-" },
        { "name": "HLTV", "url": "https://www.hltv.org/player/9984/missy" },
        { "name": "Liquip.", "url": "https://liquipedia.net/counterstrike/Missy" },
        { "name": "Steam", "url": "https://steamcommunity.com/profiles/76561198025363723" },
        { "name": "Twitter", "url": "https://x.com/MissyRezero" }
    ]
}
