{
    "$schema": "../../schemas/player.schema.json",

    "slug": "maneschijnx",
    "nickname": "ManeschijnX",
    "name": "Luna Akkermans",
    "birthday": "2000-09-06",
    "nationality": "nl",
    "links": [
        { "name": "ESEA", "url": "https://play.esea.net/users/2760749" },
        { "name": "FACEIT", "url": "https://www.faceit.com/en/players/De13th" },
        { "name": "HLTV", "url": "https://www.hltv.org/player/22603/maneschijnx" },
        { "name": "Liquip.", "url": "https://liquipedia.net/counterstrike/ManeschijnX" },
        { "name": "Steam", "url": "https://steamcommunity.com/profiles/76561199008948232" },
        { "name": "Twitch", "url": "https://www.twitch.tv/maneschijnx" },
        { "name": "Twitter", "url": "https://x.com/a_luna_mila" },
        { "name": "YouTube", "url": "https://www.youtube.com/@ManeschijnXcs" }
    ]
}
