{
    "$schema": "../../schemas/player.schema.json",

    "slug": "kezziwow",
    "nickname": "kezziwOw",
    "name": "Héjja Kászandrá",
    "birthday": "1996-01-04",
    "nationality": "hu",
    "links": [
        { "name": "ESEA", "url": "https://play.esea.net/users/781496" },
        { "name": "FACEIT", "url": "https://www.faceit.com/en/players/kezziwOw" },
        { "name": "HLTV", "url": "https://www.hltv.org/player/13550/kezziwow" },
        { "name": "Instagram", "url": "https://www.instagram.com/kezziwow" },
        { "name": "Liquip.", "url": "https://liquipedia.net/counterstrike/KezziwOw" },
        { "name": "Steam", "url": "https://steamcommunity.com/id/krumplibogarka/" },
        { "name": "Twitch", "url": "https://www.twitch.tv/kezziwow" },
        { "name": "Twitter", "url": "https://x.com/kezziwow" }
    ]
}
